{
  "schema_version": "1.1",
  "project": {
    "name": "Karya",
    "objective": "Maintain navigable source ownership and explicit relationships across all Karya, its coordinator, four independent Factories, skill packages, contracts, tools, examples, templates, website and visual identity."
  },
  "nodes": [
    {
      "id": "n-a54ff182c7e8",
      "label": "Regras do repositório",
      "kind": "operation",
      "summary": "Invariantes obrigatórios, limites entre Factories e ciclo de manutenção do mapa.",
      "path": "AGENTS.md",
      "target": "file",
      "status": "existing",
      "authority": "primary",
      "fingerprint": "400a59ad0e91bce21195d05104f91a1ccbf059add3df313e9cc42a1828ce370e"
    },
    {
      "id": "n-b33563055168",
      "label": "Entrada pública de Karya",
      "kind": "product",
      "summary": "Apresentação, instalação, catálogo, navegação viva e primeiros passos.",
      "path": "README.md",
      "target": "file",
      "status": "existing",
      "authority": "primary",
      "fingerprint": "630b86209f805aaa66f0c2e433dcf126c3458cc8f05abb4706c30266af65ff66"
    },
    {
      "id": "n-98f25c14eed9",
      "label": "Karya Architecture",
      "kind": "architecture",
      "summary": "Karya is the umbrella system for four independent, explicitly invoked Factories:",
      "path": "docs/karya-architecture.md",
      "target": "file",
      "status": "existing",
      "authority": "primary",
      "fingerprint": "e39a9b82db2ed00b6856de8244e0daf9663dd40cab32747e7b9e2220a022d215"
    },
    {
      "id": "n-c3db765145ed",
      "label": "Skill Catalog",
      "kind": "contract",
      "summary": "Karya provides one optional conversational coordination skill plus specialist skills divided into four independent Factories. Users may invoke `$karya` to receive an explained route and continue through approved specialist capabilities without learning the catalog first, or invoke a specialist directly when the route is already known. Research, Marketing, and Project Harness are never implicit prerequisites of MVP construction or of one another.",
      "path": "specs/skill-catalog.md",
      "target": "file",
      "status": "existing",
      "authority": "primary",
      "fingerprint": "771801c05c7d894f95326384b06a4337d8b12f0f42f8e901f9acff493cbfc79c"
    },
    {
      "id": "n-b6c5ad248937",
      "label": "Factory Handoff Contracts",
      "kind": "contract",
      "summary": "The MVP, Research, Marketing, and Project Harness Factories are independent. The handoffs below describe compatible artifacts, not a mandatory global pipeline. A consumer runs only after explicit user invocation or approval; a producer must never trigger it silently. `$karya` may recommend and coordinate an approved handoff, but it does not change this boundary.",
      "path": "specs/factory-handoff-contracts.md",
      "target": "file",
      "status": "existing",
      "authority": "primary",
      "fingerprint": "b1e7c08a2e13def62a7ee1420019a260a323a21bc572d789ef32180c83926186"
    },
    {
      "id": "n-32c1cf49a2fe",
      "label": "Skills instaláveis",
      "kind": "code",
      "summary": "Pacotes independentes das quatro Factories e coordenação opcional; cada SKILL.md define seu contrato.",
      "path": "skills",
      "target": "directory",
      "status": "existing",
      "authority": "primary",
      "fingerprint": "bfd0b1f655c0f009deb511f6d5b68f9b3b83afdc24d133efb165108f145c04a1"
    },
    {
      "id": "n-46b42b4229cd",
      "label": "Arquitetura e métodos",
      "kind": "architecture",
      "summary": "Fontes de verdade sobre método, arquitetura, workflows e identidade de Karya.",
      "path": "docs",
      "target": "directory",
      "status": "existing",
      "authority": "primary",
      "fingerprint": "c7ed9c241ffabd6687a10f3a07bc58a671ef03be29b58bb6f44bcaa6edbb9b83"
    },
    {
      "id": "n-7846086ae9fc",
      "label": "Contratos e Specs",
      "kind": "contract",
      "summary": "Contratos duráveis de escopo e handoff; não representam automaticamente uma execução ativa.",
      "path": "specs",
      "target": "directory",
      "status": "existing",
      "authority": "primary",
      "fingerprint": "ad3822dbadc1d3b147f51b31776059176f33031b8e56b0c9537e1de19c6dedd5"
    },
    {
      "id": "n-fbae041b02c4",
      "label": "Site oficial Karya",
      "kind": "product",
      "summary": "Aplicação React/TypeScript que apresenta o sistema, a coordenação e as quatro Factories.",
      "path": "site",
      "target": "directory",
      "status": "existing",
      "authority": "primary",
      "fingerprint": "5141c6d24f837d1c0755d19f305cc29f56133baabaf5b6c087c56554f7ef288e"
    },
    {
      "id": "n-069b0dbb39d6",
      "label": "Identidade visual Karya",
      "kind": "product",
      "summary": "Ativos visuais oficiais preservados; regras em docs/branding.md.",
      "path": "assets/brand",
      "target": "directory",
      "status": "existing",
      "authority": "primary",
      "fingerprint": "e8f386eff3b301b9c0d45859e20ecdfe1bc5d3485ec24b1d1252e236a3f01d59"
    },
    {
      "id": "n-9c6641c1f9cf",
      "label": "Starters compartilhados",
      "kind": "reference",
      "summary": "Orientação e organização para material reutilizável de projetos gerados.",
      "path": "templates",
      "target": "directory",
      "status": "existing",
      "authority": "primary",
      "fingerprint": "439a36f04e52cbbb58232e0dcc25f9c980299ea4042d86abf6dae68793b06b66"
    },
    {
      "id": "n-c590b3c924c3",
      "label": "Exemplos de contratos e projetos",
      "kind": "reference",
      "summary": "Amostras e fixtures por Factory; não são produção nem histórico executado da Karya.",
      "path": "examples",
      "target": "directory",
      "status": "existing",
      "authority": "primary",
      "fingerprint": "f4c94958d0bda05ca4ea17834a99c7bc42eb3ff803eb8f49d0110e4505b05d38"
    },
    {
      "id": "n-e980e1921077",
      "label": ".codex/references/repository-map.md",
      "kind": "operation",
      "summary": "Source declared in the accepted Harness plan.",
      "path": ".codex/references/repository-map.md",
      "target": "file",
      "status": "existing",
      "authority": "primary",
      "fingerprint": "a6cbd1b1ada314e1090ccde6cffdaec5c22eadae5ff51283fa77b0dc28892cdf"
    },
    {
      "id": "n-4194dac67277",
      "label": ".codex/references/project-harness.md",
      "kind": "operation",
      "summary": "Source declared in the accepted Harness plan.",
      "path": ".codex/references/project-harness.md",
      "target": "file",
      "status": "existing",
      "authority": "primary",
      "fingerprint": "0e6c206e7606f5f9b5e19ed5ccc0814aa3ddda4c23859cdcfa2783f45019b585"
    },
    {
      "id": "n-a0a14512336f",
      "label": "MVP Factory",
      "kind": "workflow",
      "summary": "MVP Factory. Workflow independente definido nesta fonte e em specs/skill-catalog.md.",
      "path": "docs/product-workflow.md",
      "target": "file",
      "status": "existing",
      "authority": "supporting",
      "fingerprint": "565500d748b7cea208810c957675ccafa10ddb8ab6ab0f0f7ac991308f2d2c46"
    },
    {
      "id": "n-7bf810db6273",
      "label": "Research Factory",
      "kind": "workflow",
      "summary": "Research Factory. Workflow independente definido nesta fonte e em specs/skill-catalog.md.",
      "path": "docs/research-workflow.md",
      "target": "file",
      "status": "existing",
      "authority": "supporting",
      "fingerprint": "607891caa2e0cb8c01678d892c50542899f11c80302e16f7e5bb6c37123430b5"
    },
    {
      "id": "n-cf1d3f68c1ff",
      "label": "Marketing Factory",
      "kind": "workflow",
      "summary": "Marketing Factory. Workflow independente definido nesta fonte e em specs/skill-catalog.md.",
      "path": "docs/marketing-workflow.md",
      "target": "file",
      "status": "existing",
      "authority": "supporting",
      "fingerprint": "0637b680b1b87bf53eeba35f983316095719aeefa274c6ee1c0e3816b2623213"
    },
    {
      "id": "n-ad47f38e78a7",
      "label": "Project Harness Factory",
      "kind": "workflow",
      "summary": "Project Harness Factory. Workflow independente definido nesta fonte e em specs/skill-catalog.md.",
      "path": "docs/project-harness-factory.md",
      "target": "file",
      "status": "existing",
      "authority": "supporting",
      "fingerprint": "ad90d8734d61ddf719ff23904d8e55f61aadeb2f3a080411748292854039999f"
    },
    {
      "id": "n-27b26f9ecc89",
      "label": ".codex/decisions",
      "kind": "reference",
      "summary": "Material durável desta área; consulte os arquivos originais para as regras específicas.",
      "path": ".codex/decisions",
      "target": "directory",
      "status": "existing",
      "authority": "supporting",
      "fingerprint": "331f6875ae8382bc8c7ac9b7ad9415eef1caebdf7385a6ee9b6766a986c02b47"
    },
    {
      "id": "n-fe9c8ff1a869",
      "label": "Active Spec path pattern",
      "kind": "spec",
      "summary": "Pattern only, not a selected active Spec.",
      "path": "specs/active/SPEC-NNN",
      "target": "pattern",
      "status": "planned",
      "authority": "supporting",
      "fingerprint": null
    },
    {
      "id": "n-6eaf23ea94a1",
      "label": "Runtime policy",
      "kind": "runtime",
      "summary": "Policy path declared in accepted plan.",
      "path": ".codex/references/runtime-policy.json",
      "target": "file",
      "status": "existing",
      "authority": "supporting",
      "fingerprint": "e99db93e16bd933e0ab0b26e74d06c2757a958c881ad0c3e574fdb4d21495e69"
    },
    {
      "id": "n-f1ecf3947b77",
      "label": "Accepted bootstrap plan",
      "kind": "reference",
      "summary": "Historical input; validation commands are declarations, not proof of execution.",
      "path": ".codex/decisions/project-harness-bootstrap.json",
      "target": "file",
      "status": "existing",
      "authority": "supporting",